Comment,phi3.5 - Sentiment,phi3.5 - Reasoning,phi3.5 - Total Duration,phi3.5 - Load Duration,phi3.5 - Prompt Eval Count,phi3.5 - Prompt Eval Duration,phi3.5 - Eval Count,phi3.5 - Eval Duration,phi3.5 - Temperature,phi3.5 - Seed,phi3.5 - Num_ctx
Leaving.  Very impressive but getting old.  Peace out.,NEUTRAL,"The sentiment of the comment is neutral with a slight lean towards positive undertones. Here's the detailed analysis:   Tone Analysis - The tone starts off as appreciative, indicated by 'Very impressive,' which suggests that the speaker acknowledges something noteworthy or skillful about what they witnessed on YouTube (possibly related to card tricks). However, it transitions into a more reflective and slightly negative sentiment with 'getting old' and concludes with 'Peace out.' The phrase 'Leaving,' combined with these mixed emotions, suggests that the speaker is moving away from their current situation. Key Phrases - While phrases like 'Very impressive' convey admiration or positive feelings towards what they have seen, terms such as 'getting old' and a final farewell ('Peace out') introduce an element of resignation about aging which can be perceived negatively in some contexts. Context Consideration - Without additional video content to directly relate the comment to specific events within it (as no transcript was provided), we infer that this is likely a standalone reaction or personal reflection rather than a direct response to an ongoing discussion from the YouTube video itself. The overall sentiment does not strongly lean towards positive, negative, nor remains neutral; instead, these contrasting elements balance each other out. Conclusion - Given the appreciation mixed with acceptance of aging and departure in tone, this comment can be classified as having a predominantly neutral sentiment but with subtle positivity due to recognition of skill or impressiveness before concluding on leaving. Therefore, considering both positive aspects (impressive) and negative undertones (aging), the overall classification leans towards NEUTRAL rather than strongly POSITIVE or NEGATIVE.",10.76,0.01,683,2.56,393,8.20,0,1,8192
"Hey Jason, love you and your videos. My name is XXX and I'm in the US army and currently deployed in Iraq (me in pfp). Your videos have gotten me through a lot of tough days of deployment so first off thank you for entertaining me. But I have a request, I'm scheduled to come home on June 18th so if you could do a trick, any trick you like with the 6, 1, and 8 it would make my whole week. I wish you nothing but more success and growth on your channel and please keep posting so I don't die of boredom out here. I plan on going to a show when I get back this summer so post those dates as soon as you know them! All love from Iraq!""",POSITIVE,"The sentiment of the YouTube comment is positive for several reasons. Firstly, the tone throughout the message conveys gratitude and appreciation; this can be seen in phrases like 'love you' directed at Jason, acknowledging his videos as a source of entertainment during tough times ('gotten me through a lot of tough days'). The commenter also expresses excitement about future plans by mentioning they will attend a show and are looking forward to it. They extend thanks with phrases like 'thank you for entertaining me' and wish Jason success, which indicates respect and admiration ('please keep posting so I don’t die of boredom'). The use of the word 'all love from Iraq' further emphasizes their positive feelings towards Jason. Although there is a request made with specific numbers (6, 1, and 8), it does not carry any negative connotations but rather shows enthusiasm for engaging in an interactive element that they hope will be entertaining or amusing during the commenter's deployment period. The overall sentiment leans towards positive because of these expressions of gratitude, admiration, and anticipation.",5.98,0.00,836,0.33,267,5.64,0,1,8192
He even trash talks himself  truly no one is safe,NEGATIVE,"The sentiment of the comment 'He even trash talks himself truly no one is safe' can be classified as negative. Here's a detailed analysis:   Tone Analysis - The tone conveyed by this statement is critical and disapproving, suggesting that someone may have said something hurtful or damaging about themselves without considering the consequences. Key Phrases/Words Influencing Decision - 'trash talks himself' directly criticizes an individual for speaking negatively about their own actions or character in a way that is likely to be self-deprecating and harmful, while 'no one is safe' implies vulnerability among people due to the presence of such behavior. Context Consideration - While there isn't explicit video context provided with this comment alone, comments like these often arise from situations where individuals are discussing personal experiences or opinions related to self-criticism and its impact on others within a community setting. The choice of words 'trash talks himself' indicates dissatisfaction and disapproval towards the subject's behavior. Given that there is no positive aspect highlighted in this comment, it leans heavily into negative sentiment territory. Therefore, based on tone analysis, key phrases used, and lacking any neutral or purely factual context to counterbalance these sentiments, we can confidently classify this as a NEGATIVE statement regarding the individual'sinvolvement with self-criticism.",6.76,0.00,682,0.07,325,6.68,0,1,8192
"Welcome to the hustle, indeed! 😅 I love how the ""includes paid promotion"" tag was there. I don't even know what's real anymore. But you are still the goal.",POSITIVE,"The sentiment of this YouTube comment is positive, as indicated by several elements in its content:   # Tone analysis The tone expressed throughout the comment is light-hearted and playful. This can be inferred from phrases like 'Welcome to the hustle,' which suggests a casual invitation into competitive or ambitious activities often associated with positive engagement, paired with an evident smile through the use of emojis (😅).   # Key Phrases The commenter's appreciation for what appears to be paid promotion is clear from their statement about loving how it was tagged. Despite a hint of skepticism or humor regarding authenticity ('I don't even know what's real anymore'), the overall tone remains upbeat and engaged rather than dismissive, which leans towards positivity.   # Context Consideration Although there is no direct video context provided in this comment snippet alone, it seems to be a response that builds upon an advertisement or promotional content related to Dr Elana's cosmetic dentistry services for $500 as mentioned earlier in the task prompt. The fact that they are engaging with and acknowledging such promotion indicates their interest rather than disinterest, contributing positively to the sentiment analysis.   # Overall Conclusion Given these observations about tone, key phrases used, and context consideration (even though not directly provided), it is reasonable to classify this YouTube comment as having a positive sentiment towards Dr Elana's cosmetic dentistry service offer for $500 with an underlying sense of humor. The user seems amused by the promotion but still recognizes its value in guiding them toward professional services, which reflects positivity and engagement rather than negativity or neutrality.",8.43,0.01,715,0.12,398,8.30,0,1,8192
"""I am so good""  🤣🤣🤣",POSITIVE,"The sentiment of the comment is positive, as indicated by several factors in its tone and word choice. The use of laughter emojis '🤣' suggests that the person found something amusing or entertaining about what was said before their response. This humor often implies a light-hearted enjoyment rather than disdain or negativity, which leans towards positivity in sentiment analysis. Additionally, phrases like ",2.38,0.00,687,0.07,115,2.30,0,1,8192
It doesn't matter how many times I watch these videos  or how many times I think I might've seen something... This guy right here is hands down the best I've ever seen. It's not even close. And he seems like he'd be a helluva guy to hang out with! Thanks for all the awesome content!,POSITIVE,"The sentiment of the YouTube comment is positive, as indicated by several key phrases and words that convey enthusiasm and approval. Here's a detailed analysis:   Tone Analysis - The tone throughout the comment is upbeat and admiring; there are no indications of frustration or negativity in the speaker’s voice which would suggest otherwise. Key Phrases/Words Influencing Decision - Words such as ",2.62,0.01,743,0.17,120,2.44,0,1,8192
Nicely done and she paid 500 for an advertisement.  😂,POSITIVE,"The sentiment of the comment is positive, as indicated by several factors in its analysis: ✔️ The tone conveys amusement and light-heartedness through phrases like 'Nicely done' and laughter represented by the emoji '😂'. These expressions suggest that the commenter found humor or entertainment value in what was advertised. Additionally, referring to a payment of $500 as something one would pay for an ad indicates approval rather than disapproval. ✔️ The word choice further supports this sentiment; phrases such as 'easy' and 'welcome to the hustle' imply that they see value in both effort (hustle) and cost, which is often associated with successful ventures or opportunities worth investing time/money into. ✔️ The context of a comment directed at an advertisement for Dr Elana, a cosmetic dentist, suggests the user may be engaging with content related to personal appearance enhancement—a common reason people seek out such services and might find amusing or relatable in this scenario. While there is no direct mention of satisfaction from receiving professional service (which could have further solidified positivity), the overall tone does not convey dissatisfaction, making a negative sentiment unlikely. ✔️ The use of 'Nicely done' as an adjective to describe both the advertisement and its execution indicates approval or admiration for how well it was presented. Given these points, while there is no explicit expression of joy from receiving dental services themselves, the comment leans towards a positive sentiment about the creativity and perceived value in spending money on an ad related to cosmetic enhancement.",7.98,0.00,691,0.07,382,7.90,0,1,8192
Saw Jason live in Boca Raton. He is even better live. Definitely the GOAT!!,POSITIVE,"The sentiment of the comment provided is positive for several reasons: Firstly, there's an enthusiastic tone conveyed through exclamation marks and energetic phrasing such as 'Saw Jason live in Boca Raton. He is even better live,' which implies a superior experience when watching someone perform live versus recorded or elsewhere. The use of the superlative term 'GOAT!' (Greatest Of All Time) further emphasizes high praise and admiration, suggesting that Jason outperforms others exceptionally in his field. Additionally, there's an implicit recommendation for people to witness Jason’s talent firsthand by highlighting its superiority when he is live; this adds a persuasive element of positivity aimed at encouraging viewers or potential fans to seek him out if they can experience it themselves. The overall sentiment suggests strong approval and excitement, which align with positive emotions.",4.38,0.00,691,0.07,213,4.30,0,1,8192
Always love the waterfall trick! Truly impressive,POSITIVE,"The sentiment of the comment is positive, as indicated by several factors in its analysis. The tone of enthusiasm and admiration can be discerned from phrases such as 'Always love' and 'Truly impressive,' which convey a strong sense of enjoyment and approval towards whatever trick or performance they are discussing—presumably related to the video content mentioned earlier in the context. The word choice, particularly with terms like 'love' and 'impressive', suggests that the commenter has had positive experiences associated with similar tricks before and holds a favorable view of them. Additionally, there is an implied sense of expertise or skill involved when they refer to something as being impressive, further reinforcing their approval. The context provided earlier in the transcript indicates this might be related to some form of entertainment involving cards and visual effects (as suggested by 'waterfall' trick), which typically involves a display that would elicit admiration from an audience if executed well. There is no indication of dissatisfaction or neutrality, thus ruling out negative or purely neutral sentiments.",5.26,0.00,681,0.07,256,5.19,0,1,8192
I have been watching you very closely do these tricks and I can never spot how in the world you pull these tricks off. So after careful analysis  I have decided that Magic is 100% real and you my friend have mastered it!,POSITIVE,"The sentiment of the YouTube comment provided expresses a positive emotion towards both the individual performing magic tricks and their skill level. Here's the detailed analysis:   Tone Analysis - The tone is admiring, impressed, and supportive throughout the entirety of the comment; it conveys respect for the magician’s abilities without any negative undertones or sarcasm. Key Phrases/Words Influencing Decision - Words such as 'mastered,' 'real magic,' and 'very closely' indicate a deep appreciation for both the performance of pulling cards from thin air (a common magical illusion) and the performer’s apparent expertise in this art. The phrase ",3.65,0.00,721,0.12,174,3.52,0,1,8192
This man's CGI machine must be burning  😂,POSITIVE,"The sentiment of the comment is positive, as indicated by several factors in its tone and word choice. The use of a laughing emoji '😂' suggests that the commenter found something amusing or entertaining about the video content related to CGI machines used for extracting cards from a deck. This humor implies enjoyment rather than displeasure, which leans towards positivity. Additionally, phrases like ",2.63,0.00,684,0.07,126,2.56,0,1,8192
Another great vid. His CGI crew must be up to half a dozen employees by now to be able to keep up with all his amazing tricks  Genius is expensive,POSITIVE,"The sentiment of the YouTube comment provided can be classified as positive for several reasons. Firstly, the tone analysis reveals enthusiasm and admiration in phrases such as 'Another great vid,' which indicates that the viewer enjoyed watching the video content. The word choice further emphasizes this positivity with terms like 'amazing tricks' and 'Genius,' suggesting they find the creative or intellectual aspects of what is being presented impressive. Additionally, referring to a large crew as having reached up to ",2.97,0.00,706,0.12,139,2.84,0,1,8192
Hardest thing for Mr Jason - talking to the wall like there is actually someone standing,POSITIVE,"The sentiment of the comment provided appears to be positive, despite discussing a challenging situation. Here's the detailed analysis:   # Tone Analysis The tone is light-hearted and humorous rather than negative or angry; it seems like Mr Jason might have been struggling with communication but finds humor in his difficulty.    # Key Phrases/Words Influencing Decision ",2.21,0.01,687,0.07,106,2.13,0,1,8192
Respect for leaving in the blooper,POSITIVE,"The sentiment of the comment 'Respect for leaving in the bloop' can be classified as positive, despite its casual and potentially humorous tone. Here is the detailed analysis:   Tone Analysis - The overall tone of this statement seems light-hearted and playful rather than negative or overly critical. It implies that there was an unintentional mistake ('leaving in a bloop') but frames it as something to be respected, suggesting acceptance and humor about the situation. Key Phrases/Words - The phrase 'Respect for leaving in' indicates acknowledgment of a minor error with good-natured amusement rather than frustration or anger. This choice of words downplays any negative aspects associated with mistakes ('bloopers'). Context Consideration - While there is no direct video context provided, the comment seems to be made during an informal setting where such playful banter might occur naturally among friends or colleagues discussing a shared experience related to filmmaking or presentations. The use of 'Respect' in this casual manner suggests camaraderie and understanding that mistakes happen even when aiming for perfection ('leaving on the bloop'). Conclusion - Given these observations, it is reasonable to interpret the sentiment as positive because there is an appreciation for humanity within a potentially awkward situation. The commenter appears not only accepting of imperfections but also finds value in them by showing respect towards those who might have made such errors during their performance or presentation.",6.94,0.01,677,0.07,335,6.86,0,1,8192
Leap out of the deck??!! 😂 cgi machines ready 😂😂😂 Jason you leave me stunned my friend!!! you are so MASTER GOAT!!! ❤❤ Greetz Spiecull. 🎉,POSITIVE,"The sentiment of the YouTube comment is positive for several reasons: Firstly, there's an enthusiastic and playful tone conveyed through exclamation marks (!!!) and laughter emojis (😂), which suggest amusement or enjoyment. The word choice further amplifies this cheerfulness; phrases like 'Leap out of the deck?' are taken in a light-hearted, humorous way rather than literally expecting cards to fly from a standard playing deck. Secondly, Jason is addressed directly with praise and admiration for being ",3.11,0.00,736,0.17,145,2.94,0,1,8192
I love when someone who is the best at something is arrogant.  You've certainly earned the right.,POSITIVE,"The sentiment of this YouTube comment can be classified as positive for several reasons:   # Tone Analysis The tone of the comment is complimentary and approving, which indicates a sense of admiration rather than criticism. This positivity comes across through phrases like 'love' and 'certainly earned.' These words suggest that the speaker has high regard for someone who not only excels in their field but also possesses confidence or arrogance without negative connotations. # Key Phrases The specific phrase ",2.83,0.00,692,0.07,136,2.76,0,1,8192
Waterfall with two cards. Absolutely incredible!,POSITIVE,"The sentiment of the comment is positive, as indicated by several factors in its analysis:   Tone Analysis - The tone of excitement and admiration comes across through enthusiastic language. Key Phrases or Words Influencing Decision - Terms like 'Absolutely incredible' convey strong approval and amazement at the visual effect being described, which suggests a positive emotional response to what is likely an impressive display of cards in motion resembling a waterfall with two specific cards ('a king and an ace'). Context Consideration from Transcript - While there isn’t direct context linking this comment to the video content provided, such expressions are commonly used on platforms like YouTube when users witness something visually striking or entertaining. The use of superlatives 'absolutely incredible' indicates a high level of satisfaction and enjoyment which aligns with positive sentiment. Therefore, based on tone analysis, key phrases indicating approval, and the general connotation associated with such expressions in similar contexts, it is reasonable to classify this comment as having a POSITIVE sentiment towards whatever visual or performance they are describing.",5.32,0.00,681,0.07,259,5.25,0,1,8192
I really enjoy this channel. Your card manipulation skills are mind blowing. Take care eh ✌️🇨🇦,POSITIVE,"The sentiment of the YouTube comment is positive for several reasons: Firstly, the tone conveyed by phrases such as 'I really enjoy this channel' and 'Your card manipulation skills are mind blowing' indicates a strong appreciation and admiration. The use of superlatives like 'mind-blowing' amplifies the enthusiasm towards the content creator’s skill set, suggesting that it exceeded expectations in some way. Additionally, the commenter expresses positive feelings with phrases such as 'Take care,' which is a friendly and caring sentiment often used when someone enjoys another person's work or talent. The inclusion of an emoji (✌️) along with a national flag ('eh ✌️🇨🇦') adds to the warmth, suggesting personal connection or shared cultural context that can enhance positive feelings towards someone they admire. There is no indication of dissatisfaction or neutrality; instead, there's an evident pleasure in engaging with and enjoying what has been presented on-screen which aligns well with a POSITIVE sentiment classification.",5.46,0.01,702,0.12,263,5.33,0,1,8192
Aha!mm     i figuree it out ...If you look at the dark silver car thats just behind Jasons head  on the book shelf  payclose  attention to the angle of the green case .. then after he touches his face  roughly around 42 seconds in  you will notice that i have no idea how he does it,POSITIVE,"The sentiment expressed in this YouTube comment is positive for several reasons. Firstly, the tone of excitement and admiration can be inferred from phrases like 'Aha!' which indicates a moment of realization or discovery with enthusiasm. The use of all caps ('I figuree it out') further emphasizes their strong reaction to noticing something specific about Jason's car behind his head, suggesting they found this detail particularly interesting or clever. Additionally, the comment implies that there is some skill involved in what has been observed since it refers to a 'green case,' which might be related to automot extrusion technology used for customizing cars with special effects like changing colors based on angles of light—a complex and impressive feat if true. The word choice such as 'close attention' shows that the commenter took time to notice this detail, adding weight to their positive sentiment about it being noteworthy or surprisingly done well. Furthermore, there is a playful element in how they describe Jason’s actions ('roughly around 42 seconds in'), which adds an amusing and light-hearted tone to the commentary. The overall context of watching someone perform something impressive aligns with positive feedback as it often involves praise or admiration for skill, creativity, or ingenuity.",6.00,0.00,741,0.17,293,5.82,0,1,8192
"""Shuffles legit obviously.""",POSITIVE,"The sentiment of the comment 'Shuffles legit obviously.' is positive for several reasons. Firstly, from a tone analysis perspective, the word choice and phrasing convey confidence in their statement; they are not doubting or questioning but affirmatively stating that something (presumably related to shuffling cards) has been done correctly. The use of 'legit' suggests authenticity and adherence to proper procedures which is often associated with positive outcomes, especially when discussing a task like card handling in the context provided by the video transcript about performing an impressive feat involving playing cards using CGI effects. Secondly, key phrases such as 'obviously,' reinforce this certainty and positivity; there's no room for ambiguity or negativity here—it is clear that they believe what has been done meets their standards of legitimacy. Lastly, considering the context from the video transcript where a challenging card trick involving leaping cards out of a deck was being attempted, this comment serves as an endorsement and approval of the execution within that specific scenario. The speaker seems to be engaged with or at least appreciative of the performance they are witnessing, which aligns with positive sentiment. Therefore, based on these observations, it is reasonable to classify the emotional tone conveyed by this comment as positive.",5.95,0.00,675,0.07,303,5.88,0,1,8192
