Comment,phi3.5 - Sentiment,phi3.5 - Reasoning,phi3.5 - Total Duration,phi3.5 - Load Duration,phi3.5 - Prompt Eval Count,phi3.5 - Prompt Eval Duration,phi3.5 - Eval Count,phi3.5 - Eval Duration,phi3.5 - Temperature,phi3.5 - Seed,phi3.5 - Num_ctx
Leaving.  Very impressive but getting old.  Peace out.,NEUTRAL,"The sentiment of the comment is neutral with a slight lean towards positive undertones. Here's the detailed analysis:   Tone Analysis - The tone starts off as appreciative, indicated by 'Very impressive,' which suggests that the speaker acknowledges something noteworthy or skillful about what they witnessed on YouTube (possibly related to card tricks). However, it transitions into a more reflective and slightly negative sentiment with 'getting old' and concludes with 'Peace out.' The phrase 'Leaving,' combined with these mixed emotions, suggests that the speaker is moving away from their current situation. Key Phrases - While phrases like 'Very impressive' convey admiration or positive feelings towards what they have seen, terms such as 'getting old' and a final farewell ('Peace out') introduce an element of resignation about aging which can be perceived negatively in some contexts. Context Consideration - Without additional video content to directly relate the comment to specific events within it (as no transcript was provided), we infer that this is likely a standalone reaction or personal reflection rather than a direct response to an ongoing discussion from the YouTube video itself. The overall sentiment does not strongly lean towards positive, negative, nor remains neutral; instead, these contrasting elements balance each other out. Conclusion - Given the appreciation mixed with acceptance of aging and departure in tone, this comment can be classified as having a predominantly neutral sentiment but with subtle positivity due to recognition of skill or impressiveness before concluding on leaving. Therefore, considering both positive aspects (impressive) and negative undertones (aging), the overall classification leans towards NEUTRAL rather than strongly POSITIVE or NEGATIVE.",12.17,1.31,683,2.83,393,8.03,0,1,8192
"Hey Jason, love you and your videos. My name is XXX and I'm in the US army and currently deployed in Iraq (me in pfp). Your videos have gotten me through a lot of tough days of deployment so first off thank you for entertaining me. But I have a request, I'm scheduled to come home on June 18th so if you could do a trick, any trick you like with the 6, 1, and 8 it would make my whole week. I wish you nothing but more success and growth on your channel and please keep posting so I don't die of boredom out here. I plan on going to a show when I get back this summer so post those dates as soon as you know them! All love from Iraq!""",POSITIVE,"The sentiment of the YouTube comment is positive for several reasons. Firstly, the tone throughout the message conveys gratitude and appreciation; this can be seen in phrases like 'love you' directed at Jason, acknowledging his videos as a source of entertainment during tough times ('gotten me through a lot of tough days'). The commenter also expresses excitement about future plans by mentioning they will attend a show and are looking forward to it. They extend thanks with phrases like 'thank you for entertaining me' and wish Jason success, which indicates respect and admiration ('please keep posting so I don’t die of boredom'). The use of the word 'all love from Iraq' further emphasizes their positive feelings towards Jason. Although there is a request made with specific numbers (6, 1, and 8), it does not carry any negative connotations but rather shows enthusiasm for engaging in an interactive element that they hope will be entertaining or amusing during the commenter's deployment period. The overall sentiment leans towards positive because of these expressions of gratitude, admiration, and anticipation.",5.88,0.01,836,0.33,267,5.54,0,1,8192
He even trash talks himself  truly no one is safe,NEGATIVE,"The sentiment of the comment 'He even trash talks himself truly no one is safe' can be classified as negative. Here's a detailed analysis:   Tone Analysis - The tone conveyed by this statement is critical and disapproving, suggesting that someone may have said something hurtful or damaging about themselves without considering the consequences. Key Phrases/Words Influencing Decision - 'trash talks himself' directly criticizes an individual for speaking negatively about their own actions or character in a way that is likely to be self-deprecating and harmful, while 'no one is safe' implies vulnerability among people due to the presence of such behavior. Context Consideration - While there isn't explicit video context provided with this comment alone, comments like these often arise from situations where individuals are discussing personal experiences or opinions related to self-criticism and its impact on others within a community setting. The choice of words 'trash talks himself' indicates dissatisfaction and disapproval towards the subject's behavior. Given that there is no positive aspect highlighted in this comment, it leans heavily into negative sentiment territory. Therefore, based on tone analysis, key phrases used, and lacking any neutral or purely factual context to counterbalance these sentiments, we can confidently classify this as a NEGATIVE statement regarding the individual'sinvolvement with self-criticism.",6.64,0.00,682,0.07,325,6.57,0,1,8192
"Welcome to the hustle, indeed! 😅 I love how the ""includes paid promotion"" tag was there. I don't even know what's real anymore. But you are still the goal.",POSITIVE,"The sentiment of this YouTube comment is positive, as indicated by several elements in its content:   # Tone analysis The tone expressed throughout the comment is light-hearted and playful. This can be inferred from phrases like 'Welcome to the hustle,' which suggests a casual invitation into competitive or ambitious activities often associated with positive engagement, paired with an evident smile through the use of emojis (😅).   # Key Phrases The commenter's appreciation for what appears to be paid promotion is clear from their statement about loving how it was tagged. Despite a hint of skepticism or humor regarding authenticity ('I don't even know what's real anymore'), the overall tone remains upbeat and engaged rather than dismissive, which leans towards positivity.   # Context Consideration Although there is no direct video context provided in this comment snippet alone, it seems to be a response that builds upon an advertisement or promotional content related to Dr Elana's cosmetic dentistry services for $500 as mentioned earlier in the task prompt. The fact that they are engaging with and acknowledging such promotion indicates their interest rather than disinterest, contributing positively to the sentiment analysis.   # Overall Conclusion Given these observations about tone, key phrases used, and context consideration (even though not directly provided), it is reasonable to classify this YouTube comment as having a positive sentiment towards Dr Elana's cosmetic dentistry service offer for $500 with an underlying sense of humor. The user seems amused by the promotion but still recognizes its value in guiding them toward professional services, which reflects positivity and engagement rather than negativity or neutrality.",8.26,0.00,715,0.12,398,8.13,0,1,8192
"""I am so good""  🤣🤣🤣",POSITIVE,"The sentiment of the comment is positive, as indicated by several factors in its tone and word choice. The use of laughter emojis '🤣' suggests that the person found something amusing or entertaining about what was said before their response. This humor often implies a light-hearted enjoyment rather than disdain or negativity, which leans towards positivity in sentiment analysis. Additionally, phrases like ",2.34,0.00,687,0.07,115,2.27,0,1,8192
It doesn't matter how many times I watch these videos  or how many times I think I might've seen something... This guy right here is hands down the best I've ever seen. It's not even close. And he seems like he'd be a helluva guy to hang out with! Thanks for all the awesome content!,POSITIVE,"The sentiment of the YouTube comment is positive, as indicated by several key phrases and words that convey enthusiasm and approval. Here's a detailed analysis:   Tone Analysis - The tone throughout the comment is upbeat and admiring; there are no indications of frustration or negativity in the speaker’s voice which would suggest otherwise. Key Phrases/Words Influencing Decision - Words such as ",2.58,0.00,743,0.17,120,2.41,0,1,8192
Nicely done and she paid 500 for an advertisement.  😂,POSITIVE,"The sentiment of the comment is positive, as indicated by several factors in its analysis: ✔️ The tone conveys amusement and light-heartedness through phrases like 'Nicely done' and laughter represented by the emoji '😂'. These expressions suggest that the commenter found humor or entertainment value in what was advertised. Additionally, referring to a payment of $500 as something one would pay for an ad indicates approval rather than disapproval. ✔️ The word choice further supports this sentiment; phrases such as 'easy' and 'welcome to the hustle' imply that they see value in both effort (hustle) and cost, which is often associated with successful ventures or opportunities worth investing time/money into. ✔️ The context of a comment directed at an advertisement for Dr Elana, a cosmetic dentist, suggests the user may be engaging with content related to personal appearance enhancement—a common reason people seek out such services and might find amusing or relatable in this scenario. While there is no direct mention of satisfaction from receiving professional service (which could have further solidified positivity), the overall tone does not convey dissatisfaction, making a negative sentiment unlikely. ✔️ The use of 'Nicely done' as an adjective to describe both the advertisement and its execution indicates approval or admiration for how well it was presented. Given these points, while there is no explicit expression of joy from receiving dental services themselves, the comment leans towards a positive sentiment about the creativity and perceived value in spending money on an ad related to cosmetic enhancement.",7.85,0.00,691,0.07,382,7.78,0,1,8192
