Comment,phi4 - Sentiment,phi4 - Reasoning,phi4 - Total Duration,phi4 - Load Duration,phi4 - Prompt Eval Count,phi4 - Prompt Eval Duration,phi4 - Eval Count,phi4 - Eval Duration,phi4 - Temperature,phi4 - Seed,phi4 - Num_ctx
Leaving.  Very impressive but getting old.  Peace out.,NEUTRAL,"The comment 'Leaving. Very impressive but getting old. Peace out.' presents a mixed emotional tone, which leads to a neutral sentiment classification.

- **Tone Analysis**: The tone of the comment is somewhat ambivalent. It starts with an action ('Leaving'), followed by a positive acknowledgment ('Very impressive') and then a negative observation ('but getting old'). Finally, it ends on a casual note ('Peace out').

- **Key Phrases or Words**:
  - 'Very impressive': This phrase indicates a positive sentiment as the commenter acknowledges something noteworthy or praiseworthy.
  - 'But getting old': The word 'but' introduces a contrast to the previous positive statement, suggesting that despite being impressive, there is an aspect of it that is no longer appealing or relevant. 'Getting old' typically carries a negative connotation, implying obsolescence or decline in interest.
  - 'Peace out': This phrase is informal and neutral, often used as a casual farewell without strong emotional weight.

- **Context Consideration**: Without additional context from the video transcript, it's challenging to determine exactly what aspect of the content the commenter finds impressive yet outdated. However, the structure of the comment suggests that while there was something initially engaging or noteworthy about the content, it no longer holds the same appeal for the commenter.

Overall, the combination of positive and negative elements within the comment results in a balanced sentiment, leading to a classification as NEUTRAL.",23.78,0.02,167,4.53,324,19.22,0,1,8192
"Hey Jason, love you and your videos. My name is XXX and I'm in the US army and currently deployed in Iraq (me in pfp). Your videos have gotten me through a lot of tough days of deployment so first off thank you for entertaining me. But I have a request, I'm scheduled to come home on June 18th so if you could do a trick, any trick you like with the 6, 1, and 8 it would make my whole week. I wish you nothing but more success and growth on your channel and please keep posting so I don't die of boredom out here. I plan on going to a show when I get back this summer so post those dates as soon as you know them! All love from Iraq!""",POSITIVE,"The comment exhibits an overwhelmingly positive emotional tone, characterized by expressions of gratitude and affection. The commenter begins with a warm greeting, 'Hey Jason,' followed by 'love you and your videos,' which clearly indicates admiration and appreciation for the content creator. This sets a positive tone right from the start.

Key phrases that reinforce this sentiment include 'Your videos have gotten me through a lot of tough days of deployment so first off thank you for entertaining me.' Here, the commenter acknowledges the significant emotional support provided by Jason's videos during challenging times, expressing sincere gratitude. The use of words like 'love,' 'thank you,' and 'entertaining' further emphasizes positive feelings.

The request made in the comment is framed positively as well: 'if you could do a trick... it would make my whole week.' This shows that the commenter finds joy and anticipation in Jason's content, looking forward to something specific that will enhance their experience. The phrase 'I wish you nothing but more success and growth on your channel' conveys support for Jason's future endeavors, reinforcing a positive outlook.

Additionally, the comment ends with expressions of affection and plans for future engagement: 'All love from Iraq!' This closing statement encapsulates the overall warmth and positivity conveyed throughout the message. The context provided by mentioning deployment in Iraq adds depth to the sentiment, highlighting how much Jason's videos mean to the commenter during a challenging period.

Overall, the combination of gratitude, affectionate language, supportive wishes, and anticipation for future content strongly indicates a positive sentiment.",21.22,0.01,309,1.25,332,19.96,0,1,8192
He even trash talks himself  truly no one is safe,POSITIVE,"The comment 'He even trash talks himself, truly no one is safe' exhibits a positive sentiment. The tone of the comment suggests admiration and amusement towards the person being discussed. Key phrases that influence this decision include 'trash talks himself,' which implies that the individual has a confident or humorous personality trait where they are willing to joke about themselves. This self-deprecating humor can be seen as endearing or entertaining, indicating a positive perception of the person's character. Additionally, 'truly no one is safe' suggests that this behavior is consistent and adds an element of unpredictability or charm, further enhancing the positive sentiment. The context implies that the individual being discussed has a reputation for engaging in self-deprecating humor, which is generally viewed positively as it shows humility and relatability.",10.66,0.01,165,0.24,177,10.41,0,1,8192
"Welcome to the hustle, indeed! 😅 I love how the ""includes paid promotion"" tag was there. I don't even know what's real anymore. But you are still the goal.",POSITIVE,"The comment exhibits a positive sentiment overall, despite some elements of sarcasm and mild skepticism. Here’s a detailed breakdown:

- **Tone Analysis**: The tone is playful and light-hearted, as indicated by the use of an emoji (😅) which suggests amusement or laughter. This contributes to a generally positive emotional tone.

- **Key Phrases/Words**:
  - ""Welcome to the hustle, indeed!"" uses sarcasm but in a friendly manner, acknowledging the nature of content creation and promotion without harsh criticism.
  - ""I love how the 'includes paid promotion' tag was there."" This phrase shows appreciation for transparency, indicating that the commenter values honesty about promotional content.
  - ""I don't even know what's real anymore."" While this could be interpreted as a critique of the prevalence of sponsored content, it is presented in a humorous context rather than a negative one.
  - ""But you are still the goal."" This concluding statement clearly expresses admiration and positive regard for the person or channel being commented on. It indicates that despite any skepticism about promotional content, the commenter holds the creator in high esteem.

- **Context Consideration**: Without additional context from the video transcript, it's reasonable to infer that this comment is directed at a YouTuber known for their engaging content and possibly frequent use of paid promotions. The playful acknowledgment of these elements suggests familiarity with the channel’s style and an overall positive relationship between the commenter and the creator.

In summary, while there are hints of sarcasm and mild skepticism regarding promotional practices, the comment is predominantly positive due to its humorous tone and expressions of admiration.",21.67,0.01,192,0.44,356,21.22,0,1,8192
"""I am so good""  🤣🤣🤣",POSITIVE,"The comment 'I am so good' accompanied by three laughing emojis (🤣) suggests a light-hearted and humorous tone. The use of the phrase 'so good' can be interpreted as self-deprecating humor, where the commenter is likely joking about themselves in a playful manner. This kind of humor often conveys positivity because it shows that the person is comfortable enough to laugh at themselves or the situation. Additionally, the repetition of the laughing emojis emphasizes amusement and enjoyment, reinforcing the positive sentiment. There is no context from a transcript provided, but based on the comment alone, the tone is clearly jovial and self-mocking in a good-natured way.",9.23,0.01,169,0.24,153,8.98,0,1,8192
It doesn't matter how many times I watch these videos  or how many times I think I might've seen something... This guy right here is hands down the best I've ever seen. It's not even close. And he seems like he'd be a helluva guy to hang out with! Thanks for all the awesome content!,POSITIVE,"The emotional tone of the comment is overwhelmingly positive, as evidenced by enthusiastic and complimentary language. The commenter expresses admiration and appreciation multiple times throughout their message.

Key phrases that influenced this decision include:
- ""hands down the best I've ever seen"": This phrase indicates a high level of praise and suggests that the person being referred to surpasses all others in quality or ability.
- ""It's not even close"": Reinforces the sentiment by emphasizing the superiority of the subject over any potential competitors.
- ""seems like he'd be a helluva guy to hang out with!"": This phrase adds a personal, positive touch, suggesting that beyond their skills or content, the person is likable and enjoyable in social settings.
- ""Thanks for all the awesome content!"": Expresses gratitude and appreciation for the content provided, further underscoring the positive sentiment.

The context of the comment suggests that it is directed towards a creator who produces videos. The commenter's repeated viewings and continued admiration indicate satisfaction with the content, reinforcing the positive sentiment. There are no negative or neutral phrases present in this comment, making the overall tone distinctly positive.",15.83,0.01,221,0.65,255,15.17,0,1,8192
Nicely done and she paid 500 for an advertisement.  😂,NEUTRAL,"The comment 'Nicely done and she paid 500 for an advertisement. 😂' exhibits a mixed emotional tone that leans towards neutral. Here's the detailed analysis:

- **Tone Analysis**: The phrase 'Nicely done' suggests approval or commendation, which is positive in nature. However, this positivity is tempered by the context provided in the rest of the comment.

- **Key Phrases and Words**: 
  - 'Nicely done': This indicates a positive sentiment as it implies that something was accomplished well.
  - 'she paid 500 for an advertisement': This phrase introduces a factual statement about a transaction, which is neutral on its own. However, the context in which this fact is presented can influence the overall tone.
  - '😂' (laughing emoji): The use of the laughing emoji suggests that the commenter finds humor or irony in the situation. This could imply disbelief or sarcasm regarding the amount paid for an advertisement, which might be perceived as excessive or surprising.

- **Context Consideration**: Without additional context from a transcript or video content, it's challenging to determine whether the payment of 500 is considered reasonable or exorbitant within the specific scenario. The emoji suggests that the commenter finds humor in the situation, possibly indicating that they think the amount paid was unexpectedly high for an advertisement.

Overall, while there are elements of both positive and negative sentiment (commendation vs. potential sarcasm), the comment does not strongly lean towards either extreme. Therefore, it is best classified as neutral.",20.40,0.01,169,0.24,340,20.14,0,1,8192
Saw Jason live in Boca Raton. He is even better live. Definitely the GOAT!!,POSITIVE,"The comment expresses a highly positive sentiment towards Jason's live performance. The tone of the comment is enthusiastic and appreciative, as indicated by phrases like 'even better live' and 'Definitely the GOAT!!'. The use of exclamation marks further emphasizes excitement and strong approval. The phrase 'the GOAT' (Greatest Of All Time) is a superlative term often used to express admiration and high regard, suggesting that the commenter holds Jason in very high esteem. There are no negative or neutral words present; instead, the language conveys satisfaction and praise for the live performance.",8.27,0.01,174,0.25,137,8.01,0,1,8192
Always love the waterfall trick! Truly impressive,POSITIVE,"The comment 'Always love the waterfall trick! Truly impressive' exhibits a positive emotional tone. The use of the word 'love' indicates strong affection and enjoyment, which is inherently positive. Additionally, the phrase 'Truly impressive' further reinforces this sentiment by expressing admiration and approval. There are no negative or neutral words that would suggest otherwise. The context of the comment, likely in response to a video showcasing a trick involving waterfalls, supports this interpretation as it aligns with expressions of appreciation for skillful or creative content. Overall, the choice of enthusiastic language and the absence of any critical or indifferent phrases lead to classifying the sentiment as positive.",8.93,0.01,162,0.24,148,8.68,0,1,8192
I have been watching you very closely do these tricks and I can never spot how in the world you pull these tricks off. So after careful analysis  I have decided that Magic is 100% real and you my friend have mastered it!,POSITIVE,"The emotional tone of the comment is enthusiastic and admiring, which indicates a positive sentiment. The commenter expresses a sense of wonder and amazement at the magician's ability to perform tricks that are difficult for them to understand ('I can never spot how in the world you pull these tricks off'). This phrase highlights their appreciation for the skill involved.

Key phrases such as 'careful analysis' suggest that the commenter has put thought into their conclusion, adding weight to their admiration. The statement 'Magic is 100% real and you my friend have mastered it!' further emphasizes a strong positive sentiment by acknowledging both the reality of magic and the magician's exceptional skill in mastering it.

The context from the comment suggests that the viewer has been closely observing the magician's performances, which implies a level of engagement and respect for the craft. The use of 'my friend' adds a personal touch, indicating familiarity or affection towards the magician. Overall, these elements combine to convey a positive sentiment.",13.32,0.01,201,0.44,218,12.87,0,1,8192
This man's CGI machine must be burning  😂,POSITIVE,"The comment 'This man's CGI machine must be burning 😂' exhibits a positive sentiment. The tone is light-hearted and humorous, as indicated by the use of the laughing emoji (😂), which suggests amusement or entertainment. The phrase 'CGI machine must be burning' implies that the content being commented on likely involves impressive or extensive computer-generated imagery (CGI) work, suggesting admiration for the effort or quality involved. This kind of humor often reflects a positive reaction to something perceived as extraordinary or over-the-top in a good way. There is no indication of criticism or negativity; instead, it conveys enjoyment and appreciation through playful exaggeration.",8.99,0.01,165,0.24,149,8.74,0,1,8192
Another great vid. His CGI crew must be up to half a dozen employees by now to be able to keep up with all his amazing tricks  Genius is expensive,POSITIVE,"The comment exhibits an overall positive emotional tone, as evidenced by the enthusiastic language and praise directed towards the video content. The phrase 'Another great vid' immediately sets a positive tone, indicating that the commenter appreciates the quality of the videos consistently. Additionally, words like 'amazing tricks' further emphasize admiration for the creativity and skill involved in producing these videos.

The mention of the CGI crew having 'half a dozen employees' suggests an acknowledgment of the effort and resources invested into making the content possible, which is framed positively as it highlights the impressive nature of the production. The use of the word 'Genius' underscores this positive sentiment by attributing high praise to the creator's abilities.

The phrase 'is expensive' might initially seem neutral or slightly negative due to its association with cost; however, in context, it is used to emphasize the value and quality that justify such expenses. The overall context of the comment suggests admiration rather than criticism regarding the costs involved.

In summary, the positive sentiment is driven by enthusiastic praise for the video's quality, creativity, and production effort, outweighing any neutral implications from the mention of expense.",15.31,0.01,186,0.44,251,14.86,0,1,8192
Hardest thing for Mr Jason - talking to the wall like there is actually someone standing,NEGATIVE,"The comment's emotional tone appears critical and somewhat mocking. The phrase 'hardest thing' suggests difficulty or struggle, which carries a negative connotation in this context. Additionally, the imagery of 'talking to the wall like there is actually someone standing' implies that Mr. Jason is engaging in an action perceived as pointless or absurd by the commenter. This metaphorical language indicates disapproval and highlights a lack of engagement with real interaction, further emphasizing the negative sentiment. There are no positive or neutral phrases present that would counterbalance this tone. Without additional context from a transcript, it's clear that the comment is expressing dissatisfaction or criticism regarding Mr. Jason's behavior.",9.12,0.01,171,0.25,151,8.87,0,1,8192
Respect for leaving in the blooper,POSITIVE,"The comment 'Respect for leaving in the blooper' conveys a positive sentiment. The tone is appreciative and complimentary, as indicated by the use of the word 'respect.' This suggests that the commenter values or admires the decision to include the mistake (blooper) in the video. The phrase 'leaving in the blooper' implies an acknowledgment of authenticity or humor, which are generally viewed positively. There is no indication of criticism or negativity; instead, it reflects a positive reception towards the content creator's choice. Without additional context from a transcript, we can infer that the commenter appreciates transparency or entertainment value, both of which contribute to a positive sentiment.",9.29,0.01,162,0.24,154,9.04,0,1,8192
Leap out of the deck??!! 😂 cgi machines ready 😂😂😂 Jason you leave me stunned my friend!!! you are so MASTER GOAT!!! ❤❤ Greetz Spiecull. 🎉,POSITIVE,"The comment exhibits a highly positive emotional tone, characterized by enthusiasm and admiration for the content or individual being addressed (Jason). The use of multiple exclamation marks ('!!') and emojis such as '😂' and '🎉' conveys excitement and amusement. Key phrases like 'leave me stunned my friend' and 'you are so MASTER GOAT!!!' indicate a strong positive reaction, with words like 'stunned,' 'master,' and 'goat' (slang for exceptional) underscoring admiration and respect. The use of heart emojis ('❤❤') further emphasizes affection or appreciation. Additionally, the friendly closing 'Greetz Spiecull.' suggests camaraderie and goodwill. Overall, the comment is filled with positive language and expressions that clearly indicate a favorable sentiment.",11.10,0.01,200,0.44,181,10.65,0,1,8192
I love when someone who is the best at something is arrogant.  You've certainly earned the right.,POSITIVE,"The comment exhibits a positive emotional tone, as indicated by the use of words like 'love' and 'earned.' The phrase 'I love when someone who is the best at something is arrogant' suggests that the commenter appreciates or finds humor in arrogance when it accompanies high skill levels. This implies admiration for the person being discussed, despite acknowledging a typically negative trait (arrogance). Additionally, the statement 'You've certainly earned the right' reinforces this positive sentiment by suggesting that the individual's achievements justify their behavior. The overall context of the comment is supportive and complimentary, indicating respect or approval for the person’s skills and accomplishments.",8.78,0.01,174,0.25,145,8.52,0,1,8192
Waterfall with two cards. Absolutely incredible!,POSITIVE,"The comment 'Waterfall with two cards. Absolutely incredible!' exhibits a positive emotional tone and word choice. The phrase 'Absolutely incredible' is a strong indicator of admiration or amazement, suggesting that the commenter found the content exceptionally impressive. Additionally, the use of the word 'incredible' conveys enthusiasm and high praise. There are no negative words or phrases present in this comment, nor does it express any neutral sentiment such as indifference or lack of emotion. The context provided by the phrase 'Waterfall with two cards' suggests that the commenter is referring to a specific visual effect or trick, likely related to magic or card tricks, which they found impressive. Overall, the combination of enthusiastic language and positive descriptors leads to the classification of this comment as having a POSITIVE sentiment.",10.54,0.01,162,0.24,175,10.29,0,1,8192
I really enjoy this channel. Your card manipulation skills are mind blowing. Take care eh ✌️🇨🇦,POSITIVE,"The comment exhibits a positive emotional tone throughout, which is evident from the enthusiastic language and supportive expressions used by the commenter. The phrase 'I really enjoy this channel' indicates a strong appreciation for the content provided by the YouTube channel, suggesting satisfaction and pleasure derived from watching it. This sets an overall positive sentiment right at the beginning of the comment.

The use of the word 'mind blowing' to describe the card manipulation skills further emphasizes admiration and amazement. Words like 'mind blowing' are typically associated with high praise and indicate that the commenter is impressed by the skill level demonstrated in the videos. This choice of words contributes significantly to the positive sentiment as it reflects a sense of wonder and respect for the content creator's abilities.

Additionally, the closing remark 'Take care eh ✌️🇨🇦' adds a friendly and supportive tone to the comment. The use of 'eh' is often associated with Canadian English, suggesting a casual and amiable interaction. The hand gesture emoji (✌️) and the Canadian flag emoji (🇨🇦) further personalize the message, indicating camaraderie or shared identity, which enhances the positive sentiment by showing goodwill towards the content creator.

In summary, the combination of enthusiastic language, expressions of admiration, and friendly closing remarks all contribute to a clear positive sentiment in this comment.",18.00,0.01,180,0.43,296,17.56,0,1,8192
Aha!mm     i figuree it out ...If you look at the dark silver car thats just behind Jasons head  on the book shelf  payclose  attention to the angle of the green case .. then after he touches his face  roughly around 42 seconds in  you will notice that i have no idea how he does it,NEUTRAL,"The comment's emotional tone is primarily analytical and observational, focusing on a specific detail within the video. The commenter uses phrases like 'figure it out' and 'pay close attention,' which indicate an attempt to engage with the content critically rather than expressing strong emotions such as happiness or anger.

Key phrases that influenced this decision include 'i figuree it out ...If you look at the dark silver car thats just behind Jasons head on the book shelf payclose attention to the angle of the green case.' These suggest a neutral, investigative tone. The commenter is pointing out something they believe others might find interesting or noteworthy.

The phrase 'you will notice that i have no idea how he does it' introduces an element of curiosity and slight confusion but doesn't convey strong positive or negative emotions. It suggests the commenter is intrigued by the video's content, yet unable to fully understand a particular aspect, which maintains a neutral stance overall.

Without additional context from the transcript, such as whether this comment was in response to a magic trick or some other type of visual effect, it remains focused on observation and analysis. The lack of emotional language or strong opinionated words further supports the classification of the sentiment as NEUTRAL.",16.53,0.01,223,0.65,267,15.87,0,1,8192
"""Shuffles legit obviously.""",POSITIVE,"The comment 'Shuffles legit obviously.' conveys a positive sentiment. The tone is affirming and approving, as indicated by the use of the word 'legit,' which suggests authenticity or genuine quality. This term often carries a positive connotation when used in informal contexts like YouTube comments to express approval or admiration. Additionally, the word 'obviously' reinforces this sentiment by implying that the legitimacy or quality is apparent and undeniable to the commenter. There are no negative words or phrases present, nor any indication of neutrality or ambivalence. The context of a YouTube comment typically involves viewers expressing their opinions about content they have watched, and in this case, the commenter seems to be endorsing or praising 'Shuffles.' Without additional context from a transcript, we rely on the language used within the comment itself, which clearly leans towards a positive sentiment.",11.19,0.01,159,0.24,186,10.94,0,1,8192
