Comment,phi4 - Sentiment,phi4 - Reasoning,phi4 - Total Duration,phi4 - Load Duration,phi4 - Prompt Eval Count,phi4 - Prompt Eval Duration,phi4 - Eval Count,phi4 - Eval Duration,phi4 - Temperature,phi4 - Seed,phi4 - Num_ctx
Leaving.  Very impressive but getting old.  Peace out.,NEGATIVE,"The comment's emotional tone is mixed, with both positive and negative elements present. However, the overall sentiment leans towards negative due to the context of departure and dissatisfaction.

- **Tone Analysis**: The phrase 'Very impressive but getting old' indicates a recognition of quality or skill ('impressive') but also suggests that it no longer meets current standards or interests ('getting old'). This juxtaposition creates a tone of disappointment or disinterest. The closing statement, 'Peace out,' is often used to signify departure or farewell, reinforcing the negative sentiment as it implies leaving due to dissatisfaction.

- **Key Phrases**: 
  - 'Very impressive' suggests initial positive recognition.
  - 'But getting old' introduces a negative shift, indicating that what was once appreciated no longer holds value or appeal.
  - 'Leaving' and 'Peace out' are clear indicators of departure, often associated with dissatisfaction in this context.

- **Context Consideration**: Without additional context from the video transcript, we rely on the comment itself. The decision to leave ('Leaving') due to something being 'getting old' suggests that the commenter's interest or satisfaction has waned over time, leading to a negative sentiment overall.",20.68,0.01,156,4.62,271,16.05,0,1,8192
"Hey Jason, love you and your videos. My name is XXX and I'm in the US army and currently deployed in Iraq (me in pfp). Your videos have gotten me through a lot of tough days of deployment so first off thank you for entertaining me. But I have a request, I'm scheduled to come home on June 18th so if you could do a trick, any trick you like with the 6, 1, and 8 it would make my whole week. I wish you nothing but more success and growth on your channel and please keep posting so I don't die of boredom out here. I plan on going to a show when I get back this summer so post those dates as soon as you know them! All love from Iraq!""",POSITIVE,"The emotional tone of the comment is overwhelmingly positive and appreciative. The commenter begins by expressing affection with 'love you and your videos,' which sets a warm and supportive tone. This phrase indicates strong positive feelings towards Jason and his content.

Key phrases that reinforce this sentiment include 'Your videos have gotten me through a lot of tough days of deployment so first off thank you for entertaining me.' Here, the commenter acknowledges the impact of Jason's videos on their well-being during challenging times, highlighting gratitude and appreciation. The use of 'thank you' further emphasizes positive emotions.

The request made by the commenter is framed in a light-hearted manner: 'if you could do a trick, any trick you like with the 6, 1, and 8 it would make my whole week.' This shows that the commenter finds joy and anticipation in Jason's content, which contributes to their positive sentiment.

Additionally, the comment includes well-wishes for Jason's future success: 'I wish you nothing but more success and growth on your channel,' demonstrating support and positivity towards his endeavors. The request to keep posting videos ('please keep posting so I don't die of boredom out here') indicates that the commenter values and enjoys the content, further reinforcing a positive sentiment.

The closing remarks express excitement about future plans: 'I plan on going to a show when I get back this summer so post those dates as soon as you know them!' This shows enthusiasm and anticipation for engaging with Jason's work in person. The comment ends with 'All love from Iraq,' which is an affectionate sign-off, encapsulating the overall positive tone.

In summary, the commenter uses warm language, expresses gratitude, shares personal stories of how the content has positively impacted them, and looks forward to future interactions, all of which contribute to a clear classification of POSITIVE sentiment.",25.12,0.01,298,1.25,395,23.86,0,1,8192
He even trash talks himself  truly no one is safe,POSITIVE,"The comment 'He even trash talks himself, truly no one is safe' carries a positive sentiment. The tone of the comment suggests admiration and humor. The phrase 'trash talks himself' indicates that the person being discussed has a self-deprecating sense of humor or confidence, which can be seen as endearing qualities. This kind of behavior often garners respect and likability from audiences because it shows humility and relatability. Additionally, the statement 'truly no one is safe' implies that this person's wit or humor is unpredictable and entertaining, further enhancing their appeal. There are no negative words or phrases in the comment; instead, it highlights a positive trait of being able to joke about oneself. Without additional context from a transcript, we can infer that the commenter appreciates this characteristic, leading to a positive sentiment classification.",11.16,0.01,155,0.24,185,10.90,0,1,8192
"Welcome to the hustle, indeed! 😅 I love how the ""includes paid promotion"" tag was there. I don't even know what's real anymore. But you are still the goal.",POSITIVE,"The comment exhibits a positive sentiment overall, despite some elements of sarcasm or mild frustration. Here’s a detailed breakdown:

- **Tone Analysis**: The tone is playful and light-hearted, as indicated by the use of an emoji (😅) which suggests amusement or laughter. This contributes to a generally positive emotional tone.

- **Key Phrases/Words**:
  - ""Welcome to the hustle, indeed!"" uses a common phrase that acknowledges the busy nature of modern life with a touch of humor, suggesting acceptance and resilience rather than negativity.
  - ""I love how the 'includes paid promotion' tag was there."" The word ""love"" is a strong positive indicator. Despite acknowledging the presence of paid promotions, which might be seen as negative by some, the commenter expresses appreciation for transparency.
  - ""I don't even know what's real anymore."" This phrase could imply confusion or skepticism about authenticity in content, but it’s framed within a context that doesn’t express outright negativity; rather, it seems to acknowledge a common sentiment among viewers without strong disapproval.
  - ""But you are still the goal."" This concluding statement is clearly positive. It indicates admiration and respect for the person being addressed, suggesting they remain an aspirational figure despite any skepticism about content authenticity.

- **Context Consideration**: The comment seems to be in response to a video that includes paid promotions, which can sometimes lead viewers to question the genuineness of the content. However, the commenter appreciates transparency and maintains a positive view of the individual featured in the video. This context supports the overall positive sentiment as it highlights admiration despite potential concerns.

In summary, while there are elements of sarcasm or mild skepticism, the comment is predominantly positive due to expressions of love, humor, and admiration.",23.76,0.01,182,0.44,390,23.31,0,1,8192
"""I am so good""  🤣🤣🤣",POSITIVE,"The comment 'I am so good' accompanied by three laughing emojis (🤣) suggests a light-hearted and humorous tone. The phrase itself can be interpreted in multiple ways, but the context provided by the laughing emojis indicates that it is likely meant to convey self-deprecating humor or irony rather than genuine pride. This kind of humor often reflects a positive sentiment as it shows the commenter's ability to laugh at themselves or find amusement in their situation.

Key phrases and words:
- 'I am so good': On its own, this phrase could be interpreted positively if taken literally. However, when combined with the laughing emojis, it suggests irony or humor.
- Laughing emojis (🤣): These are strong indicators of a positive emotional tone, as they typically represent laughter and amusement.

Context consideration:
Without additional context from the video transcript, we rely on the comment's content and accompanying emojis. The use of laughing emojis strongly supports a positive sentiment by indicating that the commenter is amused or finding humor in their statement.",13.85,0.01,160,0.24,230,13.59,0,1,8192
It doesn't matter how many times I watch these videos  or how many times I think I might've seen something... This guy right here is hands down the best I've ever seen. It's not even close. And he seems like he'd be a helluva guy to hang out with! Thanks for all the awesome content!,POSITIVE,"The emotional tone of the comment is overwhelmingly positive, as evidenced by enthusiastic and complimentary language. The commenter expresses admiration and appreciation multiple times throughout their message.

Key phrases that indicate a positive sentiment include:
- ""hands down the best I've ever seen"": This phrase shows strong approval and high regard for the subject being discussed.
- ""It's not even close"": Reinforces the idea of superiority or exceptional quality, emphasizing the positive sentiment further.
- ""seems like he'd be a helluva guy to hang out with!"": Suggests that the commenter finds the person likable and enjoyable in a social context, adding to the positive tone.
- ""Thanks for all the awesome content!"": Expresses gratitude and appreciation for the content provided, which is inherently positive.

The overall context of the comment suggests repeated engagement with the videos, indicating satisfaction and enjoyment. The use of words like 'awesome' and expressions of personal admiration contribute to a clear positive sentiment.",13.72,0.01,211,0.65,220,13.06,0,1,8192
Nicely done and she paid 500 for an advertisement.  😂,POSITIVE,"The comment 'Nicely done and she paid 500 for an advertisement. 😂' exhibits a positive sentiment based on several factors:

- **Tone Analysis**: The tone of the comment is light-hearted and approving, as indicated by the phrase 'Nicely done.' This suggests that the commenter appreciates or approves of whatever action or content prompted this response.

- **Key Phrases/Words**: The phrase 'Nicely done' conveys a sense of approval or commendation. Additionally, the use of the emoji 😂 (laughing face) further emphasizes a positive and amused reaction to the situation described in the comment.

- **Context Consideration**: While there is no specific transcript provided for context, the mention of 'she paid 500 for an advertisement' suggests that the commenter finds it noteworthy or amusing that someone invested money into advertising. The combination of approval ('Nicely done') and humor (😂) implies a positive reaction to either the effectiveness or the unexpectedness of the advertisement.

Overall, the comment reflects a positive sentiment through its approving language and humorous tone.",14.69,0.01,159,0.24,244,14.44,0,1,8192
Saw Jason live in Boca Raton. He is even better live. Definitely the GOAT!!,POSITIVE,"The comment expresses a highly positive sentiment towards Jason's live performance. The tone of the comment is enthusiastic and appreciative, as indicated by phrases like 'even better live' and 'Definitely the GOAT!!'. The use of 'even better live' suggests that the commenter had high expectations or previous experiences with Jason's performances, which were exceeded in this instance. The acronym 'GOAT', standing for 'Greatest Of All Time', is a strong endorsement, indicating admiration and respect. There are no negative words or phrases present in the comment, reinforcing its positive nature. Without additional context from a transcript, the sentiment remains clear based on the language used.",9.08,0.01,162,0.24,150,8.82,0,1,8192
Always love the waterfall trick! Truly impressive,POSITIVE,"The comment expresses a positive emotional tone, as indicated by several key phrases and words. The phrase 'Always love' suggests a consistent appreciation or enjoyment of something, which is inherently positive. Additionally, the word 'love' itself conveys strong positive emotions. The term 'truly impressive' further reinforces this sentiment by indicating admiration and respect for the subject being discussed, in this case, the 'waterfall trick.' There are no negative words or phrases present in the comment that would suggest dissatisfaction or criticism. Without additional context from a transcript, we can infer that the commenter is expressing genuine enthusiasm and approval of whatever content they are responding to. Overall, the choice of words and tone clearly indicate a positive sentiment.",9.66,0.01,152,0.24,160,9.41,0,1,8192
I have been watching you very closely do these tricks and I can never spot how in the world you pull these tricks off. So after careful analysis  I have decided that Magic is 100% real and you my friend have mastered it!,POSITIVE,"The emotional tone of the comment is one of admiration and amazement, which indicates a positive sentiment. The commenter expresses a sense of wonder by stating they 'can never spot how in the world you pull these tricks off,' highlighting their appreciation for the skill involved. This phrase suggests that the viewer finds the magic tricks impressive and difficult to understand, contributing to a positive tone.

Key phrases such as 'after careful analysis' imply that the commenter has invested time and effort into understanding the tricks, which adds weight to their admiration. The conclusion of the comment, 'Magic is 100% real and you my friend have mastered it!' further reinforces this sentiment by acknowledging both the reality of magic and the skill of the performer. The use of 'mastered' indicates a high level of respect for the magician's abilities.

There is no context from a transcript provided in the task, but based on the comment alone, there are no negative words or phrases that would suggest dissatisfaction or criticism. Instead, the language used conveys enthusiasm and respect, leading to the classification of the sentiment as positive.",14.64,0.01,191,0.44,239,14.18,0,1,8192
This man's CGI machine must be burning  😂,POSITIVE,"The comment 'This man's CGI machine must be burning 😂' exhibits a positive sentiment. The tone is light-hearted and humorous, as indicated by the use of the laughing emoji (😂), which suggests amusement or entertainment. The phrase 'CGI machine must be burning' implies that the commenter finds the visual effects impressive to the point of humorously exaggerating their intensity or quality. This hyperbolic expression indicates a positive reaction to the CGI work, suggesting it is noteworthy and entertaining. There are no negative words or phrases present in the comment, further supporting its classification as positive.",8.24,0.01,155,0.24,136,7.99,0,1,8192
Another great vid. His CGI crew must be up to half a dozen employees by now to be able to keep up with all his amazing tricks  Genius is expensive,POSITIVE,"The comment exhibits an overall positive emotional tone, as evidenced by the enthusiastic language and praise directed towards the video content. The phrase 'Another great vid' immediately sets a positive tone, indicating that the commenter appreciates the quality of the videos consistently. Additionally, the use of words like 'amazing tricks' further emphasizes admiration for the creator's work.

The mention of the CGI crew being potentially large ('up to half a dozen employees') suggests an acknowledgment of the effort and resources invested in producing high-quality content, which is framed positively as it highlights the impressive nature of the production. The word 'Genius' underscores this positive sentiment by attributing exceptional talent or intelligence to the creator.

The phrase 'is expensive' might initially seem neutral or slightly negative due to its association with cost; however, in context, it serves to reinforce the value and quality of the work being praised. It implies that while high-quality production requires significant investment, the result is worth it, further contributing to a positive sentiment.

Overall, the comment reflects admiration and appreciation for both the content creator's skills and the effort behind producing such engaging videos.",15.15,0.01,176,0.44,248,14.70,0,1,8192
Hardest thing for Mr Jason - talking to the wall like there is actually someone standing,NEGATIVE,"The comment's emotional tone appears critical and somewhat mocking. The phrase 'hardest thing' suggests difficulty or struggle, which carries a negative connotation in this context. Additionally, the imagery of 'talking to the wall like there is actually someone standing' implies that Mr. Jason is engaging in an action perceived as futile or absurd. This metaphorical language indicates disapproval or criticism, suggesting that the commenter finds his behavior odd or ineffective. There are no positive affirmations or supportive words present in the comment, reinforcing its negative sentiment.",7.59,0.01,161,0.25,125,7.34,0,1,8192
Respect for leaving in the blooper,POSITIVE,"The comment expresses a positive sentiment. The tone is appreciative and respectful, as indicated by the use of the word 'Respect.' This suggests admiration or approval from the commenter towards the action being discussed. The phrase 'leaving in the blooper' implies that the creator chose to include an error or mistake in their content, which can be seen as a positive trait because it shows authenticity and transparency. Including bloopers is often appreciated by audiences who value genuine content over polished perfection. There are no negative words or phrases present in this comment, reinforcing its positive nature.",8.06,0.01,151,0.24,133,7.81,0,1,8192
Leap out of the deck??!! 😂 cgi machines ready 😂😂😂 Jason you leave me stunned my friend!!! you are so MASTER GOAT!!! ❤❤ Greetz Spiecull. 🎉,POSITIVE,"The comment exhibits a highly positive emotional tone, characterized by enthusiasm and admiration for the content or individual being discussed (presumably Jason). The use of multiple exclamation marks ('!!') and emojis such as '😂' and '🎉' conveys excitement and amusement. Phrases like 'leave me stunned my friend' and 'you are so MASTER GOAT!!!' indicate a strong positive reaction, with words like 'stunned,' 'master,' and 'goat' (slang for someone exceptional) underscoring admiration and respect. The use of heart emojis ('❤❤') further emphasizes affection or appreciation. Additionally, the friendly closing 'Greetz Spiecull.' suggests a warm, positive connection with the person being addressed. Overall, the combination of enthusiastic language, positive adjectives, and supportive emojis leads to the classification of this comment as POSITIVE.",12.11,0.01,190,0.44,197,11.66,0,1,8192
I love when someone who is the best at something is arrogant.  You've certainly earned the right.,POSITIVE,"The comment exhibits a positive sentiment based on several factors:

- **Tone Analysis**: The tone of the comment is appreciative and approving. The commenter expresses admiration for someone who is both skilled ('the best at something') and confident to the point of arrogance.

- **Key Phrases or Words**: The phrase 'I love when' indicates a strong positive emotion towards the subject being discussed. Additionally, describing someone as 'arrogant' in this context is framed positively because it follows an acknowledgment of their skill ('the best at something'). The statement 'You've certainly earned the right' further reinforces approval and respect for the person's achievements or status.

- **Context Consideration**: While no specific transcript context is provided, the comment implies a scenario where someone has demonstrated exceptional ability. The commenter seems to believe that such high skill justifies or even warrants a degree of arrogance, suggesting they view this trait as an acceptable consequence of success rather than a negative one.

Overall, the combination of positive language and supportive reasoning leads to classifying the sentiment as POSITIVE.",14.40,0.01,164,0.25,239,14.15,0,1,8192
Waterfall with two cards. Absolutely incredible!,POSITIVE,"The comment 'Waterfall with two cards. Absolutely incredible!' exhibits a positive emotional tone and word choice. The phrase 'Absolutely incredible' is a strong indicator of admiration or amazement, which are typically associated with positive sentiments. Additionally, the use of the word 'incredible' suggests that the commenter found something extraordinary or impressive about the waterfall with two cards. There are no negative words or phrases present in this comment, and the overall context implies enthusiasm and appreciation. Without additional context from a transcript, we rely on the language used within the comment itself to determine its sentiment.",8.12,0.01,152,0.24,134,7.87,0,1,8192
I really enjoy this channel. Your card manipulation skills are mind blowing. Take care eh ✌️🇨🇦,POSITIVE,"The comment exhibits a positive emotional tone throughout, which is evident from the enthusiastic language and supportive expressions used by the commenter. The phrase 'I really enjoy this channel' indicates a strong appreciation for the content provided by the YouTube channel, suggesting satisfaction and pleasure derived from watching it. This sets an overall positive context.

Additionally, the use of 'mind blowing' to describe the card manipulation skills further emphasizes admiration and amazement. Words like 'really,' 'enjoy,' and 'mind blowing' are strong indicators of a positive sentiment as they convey excitement and high regard for the channel's content.

The closing remark 'Take care eh ✌️🇨🇦' adds a friendly, informal tone to the comment, reinforcing a sense of camaraderie or connection with the creator. The use of the hand gesture emoji (✌️) and the Canadian flag emoji (🇨🇦) suggests a personal touch and possibly indicates that the commenter is from Canada, adding warmth and friendliness to the message.

Overall, the combination of enthusiastic language, expressions of admiration, and friendly closing remarks contribute to classifying this comment as having a positive sentiment.",15.79,0.01,170,0.43,259,15.35,0,1,8192
Aha!mm     i figuree it out ...If you look at the dark silver car thats just behind Jasons head  on the book shelf  payclose  attention to the angle of the green case .. then after he touches his face  roughly around 42 seconds in  you will notice that i have no idea how he does it,POSITIVE,"The comment exhibits a positive sentiment based on several factors. Firstly, the tone is enthusiastic and curious, as indicated by the use of 'Aha!' which suggests excitement or realization. The commenter expresses satisfaction in figuring something out ('i figuree it out'), indicating a sense of accomplishment. Additionally, the phrase 'pay close attention' shows engagement with the content, suggesting that the viewer found the video intriguing enough to analyze closely.

Key phrases such as 'look at the dark silver car,' 'angle of the green case,' and 'notice that I have no idea how he does it' reflect a positive curiosity. The commenter is intrigued by the mystery or trick presented in the video, which adds an element of enjoyment and fascination rather than frustration or negativity.

The context from the transcript suggests that the viewer is analyzing a specific moment in the video (around 42 seconds) where something interesting happens ('he touches his face'). This indicates that the content was engaging enough to prompt detailed observation. The phrase 'I have no idea how he does it' further emphasizes a positive sentiment of wonder and amazement rather than confusion or dissatisfaction.

Overall, the comment reflects an engaged and positively curious viewer who is entertained by the video's content.",16.68,0.01,213,0.65,269,16.02,0,1,8192
"""Shuffles legit obviously.""",POSITIVE,"The comment 'Shuffles legit obviously.' conveys a positive sentiment. The tone is affirming and approving, as indicated by the use of the word 'legit,' which suggests authenticity or genuine quality. This term often carries a positive connotation when used in informal contexts like social media comments. Additionally, the word 'obviously' reinforces the commenter's confidence in their statement, implying that there is no doubt about the legitimacy being discussed. The brevity of the comment does not detract from its positivity; instead, it suggests enthusiasm and certainty. Without additional context from a transcript or video content, we can infer that the commenter is expressing approval or satisfaction with 'Shuffles,' likely referring to something specific in the YouTube video. Overall, the choice of words and tone indicate a positive sentiment.",10.73,0.01,149,0.24,178,10.48,0,1,8192
